{"current":{"annotationCheckpoint":{"stateToken":"fixture:12","revision":0},"extraTags":["COMMENT=first","COMMENT=second","X-UNKNOWN=value","CASSINI_AUDIO_CHANNELS=1","CASSINI_AUDIO_DURATION_MS=60000","CASSINI_AUDIO_MATCH_POLICY=exact-opus-audio-v1","CASSINI_AUDIO_OPUS_SHA256=80dce331900d04a0f4c38df231105710108d1c53536dbb212795fd1c0b444457","CASSINI_AUDIO_SAMPLE_COUNT=2880000","CASSINI_AUDIO_SAMPLE_RATE=48000","CASSINI_CREATED_AT=2026-05-12T10:00:00Z","CASSINI_DECODE_HINT=Concatenate CASSINI_PAYLOAD_000..N for the manifest; for a transcript body concatenate CASSINI_TX_\u003cID\u003e_PAYLOAD_000..N. Each chunk set: base64url decode, gzip decompress, parse UTF-8 JSON.","CASSINI_FORMAT=org.cassini.portable-meeting/1","CASSINI_MEETING_ID=mtg_aaaaaaaaaaaaaaaaaaaaaaaaaaaaaaaaaaaaaaaaaaaaaaaaaaaaaaaaaaaaaaaa","CASSINI_PAYLOAD_CHUNK_COUNT=1","CASSINI_PAYLOAD_ENCODING=base64url+gzip+utf8json","CASSINI_PAYLOAD_GZIP_BYTES=739","CASSINI_PAYLOAD_MIME=application/vnd.cassini.portable-meeting+json","CASSINI_PAYLOAD_RAW_BYTES=1465","CASSINI_PAYLOAD_SCHEMA=https://format.gocassini.com/schema/cassini-portable-meeting-manifest-v1.schema.json","CASSINI_PAYLOAD_SHA256=ea203645107b1dbaed7a0760630636cf4abf8b9a943d6ec3e57fa9cdc32d8cba","CASSINI_PROFILE=ogg-opus","CASSINI_SPEAKER_COUNT=1","CASSINI_TRANSCRIPT_DEFAULT=english","CASSINI_TRANSCRIPT_IDS=english,spanish","CASSINI_TX_ENGLISH_PAYLOAD_CHUNK_COUNT=1","CASSINI_TX_ENGLISH_PAYLOAD_ENCODING=base64url+gzip+utf8json","CASSINI_TX_ENGLISH_PAYLOAD_GZIP_BYTES=151","CASSINI_TX_ENGLISH_PAYLOAD_MIME=application/vnd.cassini.transcript-words+json","CASSINI_TX_ENGLISH_PAYLOAD_RAW_BYTES=189","CASSINI_TX_ENGLISH_PAYLOAD_SHA256=888926c0fc4b22284caa7f1253ea1dadaee46a7e0098d065a9be4d455292ffde","CASSINI_TX_SPANISH_PAYLOAD_CHUNK_COUNT=1","CASSINI_TX_SPANISH_PAYLOAD_ENCODING=base64url+gzip+utf8json","CASSINI_TX_SPANISH_PAYLOAD_GZIP_BYTES=150","CASSINI_TX_SPANISH_PAYLOAD_MIME=application/vnd.cassini.transcript-words+json","CASSINI_TX_SPANISH_PAYLOAD_RAW_BYTES=188","CASSINI_TX_SPANISH_PAYLOAD_SHA256=d1ed877027366ce3b5f77211e1ca5b2b76e701e8ea2ed8480b8ecb8d9e369edf","DATE=2026-05-12T10:00:00Z","DESCRIPTION=Cassini portable meeting file. Decode CASSINI_PAYLOAD_*: base64url -\u003e gzip -\u003e UTF-8 JSON.","ENCODER=Cassini","TITLE=Two-engine sync"],"manifest":{"attachments":[{"contentBase64":"IyBTdW1tYXJ5","mime":"text/markdown","name":"summary.md"}],"audio":{"container":"ogg","codec":"opus","sampleRate":48000,"channels":1,"sampleCount":2880000,"durationMs":60000},"future":{"history":[{"unknown":"preserve me"}]},"integrity":{"matchPolicy":"exact-opus-audio-v1","opusAudioSha256":"80dce331900d04a0f4c38df231105710108d1c53536dbb212795fd1c0b444457","sampleRate":48000,"channels":1,"sampleCount":2880000,"durationMs":60000},"kind":"cassini-portable-meeting","meeting":{"id":"mtg_aaaaaaaaaaaaaaaaaaaaaaaaaaaaaaaaaaaaaaaaaaaaaaaaaaaaaaaaaaaaaaaa","title":"Two-engine sync","createdAtUtc":"2026-05-12T10:00:00Z","durationMs":60000},"profile":"ogg-opus","speakers":[{"id":"spk_0","label":"Alice"}],"transcripts":[{"id":"english","default":true,"format":"cassini.words.v1","language":"en","wordCount":2,"payloadRef":{"prefix":"CASSINI_TX_ENGLISH_PAYLOAD_","chunkCount":1,"sha256":"888926c0fc4b22284caa7f1253ea1dadaee46a7e0098d065a9be4d455292ffde","rawBytes":189,"gzipBytes":151,"mime":"application/vnd.cassini.transcript-words+json","encoding":"base64url+gzip+utf8json"}},{"id":"spanish","format":"cassini.words.v1","language":"es","wordCount":2,"payloadRef":{"prefix":"CASSINI_TX_SPANISH_PAYLOAD_","chunkCount":1,"sha256":"d1ed877027366ce3b5f77211e1ca5b2b76e701e8ea2ed8480b8ecb8d9e369edf","rawBytes":188,"gzipBytes":150,"mime":"application/vnd.cassini.transcript-words+json","encoding":"base64url+gzip+utf8json"}}],"version":1},"payloads":{"CASSINI_TX_ENGLISH_PAYLOAD_":{"encoding":"base64","dataBase64":"eyJmb3JtYXQiOiJjYXNzaW5pLndvcmRzLnYxIiwibGFuZ3VhZ2UiOiJlbiIsIndvcmRDb3VudCI6MiwiaXRlbXMiOlt7InNwZWFrZXIiOiJzcGtfMCIsInN0YXJ0TXMiOjAsImVuZE1zIjozMDAsInRleHQiOiJIZWxsbyJ9LHsic3BlYWtlciI6InNwa18wIiwic3RhcnRNcyI6NDAwLCJlbmRNcyI6NzAwLCJ0ZXh0Ijoid29ybGQifV19","sha256":"888926c0fc4b22284caa7f1253ea1dadaee46a7e0098d065a9be4d455292ffde","rawBytes":189,"mime":"application/vnd.cassini.transcript-words+json"},"CASSINI_TX_SPANISH_PAYLOAD_":{"encoding":"base64","dataBase64":"eyJmb3JtYXQiOiJjYXNzaW5pLndvcmRzLnYxIiwibGFuZ3VhZ2UiOiJlbiIsIndvcmRDb3VudCI6MiwiaXRlbXMiOlt7InNwZWFrZXIiOiJzcGtfMCIsInN0YXJ0TXMiOjAsImVuZE1zIjozMDAsInRleHQiOiJIb2xhIn0seyJzcGVha2VyIjoic3BrXzAiLCJzdGFydE1zIjo0MDAsImVuZE1zIjo3MDAsInRleHQiOiJtdW5kbyJ9XX0=","sha256":"d1ed877027366ce3b5f77211e1ca5b2b76e701e8ea2ed8480b8ecb8d9e369edf","rawBytes":188,"mime":"application/vnd.cassini.transcript-words+json"}},"vendor":"fixture"},"format":"cassini.transcription.v1","identity":{"documentId":"fixture-document","meetingId":"mtg_aaaaaaaaaaaaaaaaaaaaaaaaaaaaaaaaaaaaaaaaaaaaaaaaaaaaaaaaaaaaaaaa","originalAudioSha256":"80dce331900d04a0f4c38df231105710108d1c53536dbb212795fd1c0b444457"},"media":{"durationMs":60000,"evictedAt":"2026-09-29T00:00:00Z","reason":"retention","state":"evicted"},"retention":{"ageAnchor":"2026-07-01T00:00:00Z","anchorSource":"recording-completed","policyRevision":7}}
