{"current":{"annotationCheckpoint":{"stateToken":"","revision":0},"extraTags":["COMMENT=first","COMMENT=second","X-UNKNOWN=value","CASSINI_AUDIO_CHANNELS=1","CASSINI_AUDIO_DURATION_MS=60000","CASSINI_AUDIO_MATCH_POLICY=exact-opus-audio-v1","CASSINI_AUDIO_OPUS_SHA256=a6c7830637c612903d3470084320467c8f551d8c4786f04d6966177e4d2ca03a","CASSINI_AUDIO_SAMPLE_COUNT=2880000","CASSINI_AUDIO_SAMPLE_RATE=48000","CASSINI_CREATED_AT=2026-05-12T10:00:00Z","CASSINI_DECODE_HINT=Concatenate CASSINI_PAYLOAD_000..N for the manifest; for a transcript body concatenate CASSINI_TX_\u003cID\u003e_PAYLOAD_000..N. Each chunk set: base64url decode, gzip decompress, parse UTF-8 JSON.","CASSINI_FORMAT=org.cassini.portable-meeting/1","CASSINI_MEETING_ID=mtg_aaaaaaaaaaaaaaaaaaaaaaaaaaaaaaaaaaaaaaaaaaaaaaaaaaaaaaaaaaaaaaaa","CASSINI_PAYLOAD_CHUNK_COUNT=1","CASSINI_PAYLOAD_ENCODING=base64url+gzip+utf8json","CASSINI_PAYLOAD_GZIP_BYTES=647","CASSINI_PAYLOAD_MIME=application/vnd.cassini.portable-meeting+json","CASSINI_PAYLOAD_RAW_BYTES=1090","CASSINI_PAYLOAD_SCHEMA=https://format.gocassini.com/schema/cassini-portable-meeting-manifest-v1.schema.json","CASSINI_PAYLOAD_SHA256=6d2bdf6c5d165f9db6a30d13e3492670b2e235db3190bc2a896cfd65e9632607","CASSINI_PROFILE=ogg-opus","CASSINI_SPEAKER_COUNT=1","CASSINI_TRANSCRIPT_DEFAULT=english","CASSINI_TRANSCRIPT_IDS=skipped","CASSINI_TX_SKIPPED_PAYLOAD_CHUNK_COUNT=1","CASSINI_TX_SKIPPED_PAYLOAD_ENCODING=base64url+gzip+utf8json","CASSINI_TX_SKIPPED_PAYLOAD_GZIP_BYTES=92","CASSINI_TX_SKIPPED_PAYLOAD_MIME=application/vnd.cassini.transcript-words+json","CASSINI_TX_SKIPPED_PAYLOAD_RAW_BYTES=70","CASSINI_TX_SKIPPED_PAYLOAD_SHA256=7940e5668bb154a9175d6c9a447c0126ca3a242cae91475cc598a544ec62d20a","DATE=2026-05-12T10:00:00Z","DESCRIPTION=Cassini portable meeting file. Decode CASSINI_PAYLOAD_*: base64url -\u003e gzip -\u003e UTF-8 JSON.","ENCODER=Cassini","TITLE=Two-engine sync"],"manifest":{"attachments":[{"contentBase64":"IyBTdW1tYXJ5","mime":"text/markdown","name":"summary.md"}],"audio":{"container":"ogg","codec":"opus","sampleRate":48000,"channels":1,"sampleCount":2880000,"durationMs":60000},"future":{"history":[{"unknown":"preserve me"}]},"integrity":{"matchPolicy":"exact-opus-audio-v1","opusAudioSha256":"a6c7830637c612903d3470084320467c8f551d8c4786f04d6966177e4d2ca03a","sampleRate":48000,"channels":1,"sampleCount":2880000,"durationMs":60000},"kind":"cassini-portable-meeting","meeting":{"id":"mtg_aaaaaaaaaaaaaaaaaaaaaaaaaaaaaaaaaaaaaaaaaaaaaaaaaaaaaaaaaaaaaaaa","title":"Two-engine sync","createdAtUtc":"2026-05-12T10:00:00Z","durationMs":60000},"profile":"ogg-opus","speakers":[{"id":"spk_0","label":"Alice"}],"transcripts":[{"id":"skipped","default":true,"format":"cassini.words.v1","payloadRef":{"prefix":"CASSINI_TX_SKIPPED_PAYLOAD_","chunkCount":1,"sha256":"7940e5668bb154a9175d6c9a447c0126ca3a242cae91475cc598a544ec62d20a","rawBytes":70,"gzipBytes":92,"mime":"application/vnd.cassini.transcript-words+json","encoding":"base64url+gzip+utf8json"}}],"version":1},"payloads":{"CASSINI_TX_SKIPPED_PAYLOAD_":{"encoding":"base64","dataBase64":"eyJmb3JtYXQiOiJjYXNzaW5pLndvcmRzLnYxIiwibGFuZ3VhZ2UiOiJlbiIsIndvcmRDb3VudCI6MCwiaXRlbXMiOltdfQ==","sha256":"7940e5668bb154a9175d6c9a447c0126ca3a242cae91475cc598a544ec62d20a","rawBytes":70,"mime":"application/vnd.cassini.transcript-words+json"}},"sourceManifest":{"encoding":"base64","dataBase64":"eyJhdHRhY2htZW50cyI6W3siY29udGVudEJhc2U2NCI6Ikl5QlRkVzF0WVhKNSIsIm1pbWUiOiJ0ZXh0L21hcmtkb3duIiwibmFtZSI6InN1bW1hcnkubWQifV0sImF1ZGlvIjp7ImNvbnRhaW5lciI6Im9nZyIsImNvZGVjIjoib3B1cyIsInNhbXBsZVJhdGUiOjQ4MDAwLCJjaGFubmVscyI6MSwic2FtcGxlQ291bnQiOjI4ODAwMDAsImR1cmF0aW9uTXMiOjYwMDAwfSwiZnV0dXJlIjp7Imhpc3RvcnkiOlt7InVua25vd24iOiJwcmVzZXJ2ZSBtZSJ9XX0sImludGVncml0eSI6eyJtYXRjaFBvbGljeSI6ImV4YWN0LW9wdXMtYXVkaW8tdjEiLCJvcHVzQXVkaW9TaGEyNTYiOiJhNmM3ODMwNjM3YzYxMjkwM2QzNDcwMDg0MzIwNDY3YzhmNTUxZDhjNDc4NmYwNGQ2OTY2MTc3ZTRkMmNhMDNhIiwic2FtcGxlUmF0ZSI6NDgwMDAsImNoYW5uZWxzIjoxLCJzYW1wbGVDb3VudCI6Mjg4MDAwMCwiZHVyYXRpb25NcyI6NjAwMDB9LCJraW5kIjoiY2Fzc2luaS1wb3J0YWJsZS1tZWV0aW5nIiwibWVldGluZyI6eyJpZCI6Im10Z19hYWFhYWFhYWFhYWFhYWFhYWFhYWFhYWFhYWFhYWFhYWFhYWFhYWFhYWFhYWFhYWFhYWFhYWFhYWFhYWFhYWFhIiwidGl0bGUiOiJUd28tZW5naW5lIHN5bmMiLCJjcmVhdGVkQXRVdGMiOiIyMDI2LTA1LTEyVDEwOjAwOjAwWiIsImR1cmF0aW9uTXMiOjYwMDAwfSwicHJvZmlsZSI6Im9nZy1vcHVzIiwic3BlYWtlcnMiOlt7ImlkIjoic3BrXzAiLCJsYWJlbCI6IkFsaWNlIn1dLCJ0cmFuc2NyaXB0cyI6W3siaWQiOiJza2lwcGVkIiwiZGVmYXVsdCI6dHJ1ZSwiZm9ybWF0IjoiY2Fzc2luaS53b3Jkcy52MSIsInBheWxvYWRSZWYiOnsicHJlZml4IjoiQ0FTU0lOSV9UWF9TS0lQUEVEX1BBWUxPQURfIiwiY2h1bmtDb3VudCI6MSwic2hhMjU2IjoiNzk0MGU1NjY4YmIxNTRhOTE3NWQ2YzlhNDQ3YzAxMjZjYTNhMjQyY2FlOTE0NzVjYzU5OGE1NDRlYzYyZDIwYSIsInJhd0J5dGVzIjo3MCwiZ3ppcEJ5dGVzIjo5MiwibWltZSI6ImFwcGxpY2F0aW9uL3ZuZC5jYXNzaW5pLnRyYW5zY3JpcHQtd29yZHMranNvbiIsImVuY29kaW5nIjoiYmFzZTY0dXJsK2d6aXArdXRmOGpzb24ifX1dLCJ2ZXJzaW9uIjoxfQ==","sha256":"6d2bdf6c5d165f9db6a30d13e3492670b2e235db3190bc2a896cfd65e9632607","rawBytes":1090,"mime":"application/json"},"vendor":"fixture"},"format":"cassini.transcription.v1","identity":{"documentId":"b608f73f7fb5d753c046e0148d5bdb10","meetingId":"mtg_aaaaaaaaaaaaaaaaaaaaaaaaaaaaaaaaaaaaaaaaaaaaaaaaaaaaaaaaaaaaaaaa","originalAudioSha256":"a6c7830637c612903d3470084320467c8f551d8c4786f04d6966177e4d2ca03a"},"media":{"durationMs":60000,"evictedAt":"2026-09-29T18:02:53.107728514Z","reason":"retention","state":"evicted"},"retention":{"ageAnchor":"2026-09-29T18:02:53.107728514Z","anchorSource":"recording-completed","policyRevision":0}}
